{
  "$schema": "https://json-schema.org/draft/2020-12/schema",
  "$id": "https://nikatru.invalid/contracts/name-clearance.schema.json",
  "title": "name-clearance",
  "description": "THE SHAPE OF apps/<app>/name-clearance.json — the record `tooling/store/name-clearance.mjs --execute` writes and `tooling/ci/assert-name-clearance.mjs` reads. A clearance is a MEASUREMENT WITH A DATE, not a permanent fact: names get taken. The dating mechanism is not invented here — it is `{value, asOf, verify, verifyKind}` from Private/platform-state/schema/fact.schema.json, verbatim, with verifyKind:\"remote\" because that is precisely what tells a pre-commit hook not to dial out. Validated by tooling/app-yaml/schema-validate.mjs, whose implemented-keyword set is closed: a keyword this schema names and that validator does not implement is refused rather than skipped.",
  "type": "object",
  "required": ["app", "slug", "name", "overall", "asOf", "channels", "identifiers", "trademark", "controls"],
  "additionalProperties": false,
  "properties": {
    "_why": {
      "type": "array",
      "description": "GENERATED prose: exactly `whyLines(record)` from tooling/store/name-clearance-why.mjs, computed from this record's own fields and written by tooling/store/name-clearance.mjs on every write. Regenerate it offline with `node tooling/store/name-clearance.mjs --why --app <slug>`; limb 11 of tooling/ci/assert-name-clearance.mjs refuses any other text. Optional in the shape so the guard, not the schema, names the command that fixes an absent one.",
      "items": { "type": "string" }
    },
    "app": {
      "type": "string",
      "format": "repo-path",
      "description": "The app slug this record belongs to. Must be the directory it sits in — a record filed under the wrong app is a clearance for somebody else's name."
    },
    "slug": {
      "type": "string",
      "description": "The lowercased identifier form of the name: the snap name, the AMO slug, the subdomain. Distinct from `app` because a rename changes this before it changes the directory."
    },
    "name": {
      "type": "object",
      "description": "THE FACT TRIPLE. `value` is the name that was cleared, and the guard compares it against apps/<app>/app.yaml's `name:`. A record for a different name is not a record.",
      "required": ["value", "asOf", "verify", "verifyKind"],
      "additionalProperties": false,
      "properties": {
        "value": { "type": "string", "minLength": 1 },
        "asOf": { "type": "string", "format": "date" },
        "verify": { "type": "string", "minLength": 4 },
        "verifyKind": {
          "type": "string",
          "enum": ["remote"],
          "description": "ALWAYS `remote`, and the enum is closed to one value on purpose. Re-deriving a clearance means ~20 external calls over ~16.5 s. `remote` is the flag a hook reads to refuse to run it, which is the whole reason the field exists rather than the guard sniffing the command string."
        }
      }
    },
    "asOf": {
      "type": "string",
      "format": "date",
      "description": "The day the probes ran. Duplicated out of `name.asOf` so the staleness limb can age the RECORD even if the name triple is edited by hand."
    },
    "overall": {
      "type": "string",
      "enum": ["CLEAR", "QUALIFIED", "BLOCKED", "UNDETERMINED"],
      "description": "CLEAR — every channel that can answer said free. QUALIFIED — nothing blocks and something is owed (an owner ruling, a manual step). BLOCKED — a record was READ that holds the name on a channel that refuses duplicates. UNDETERMINED — coverage was lost on a globally-unique channel, which is not a pass."
    },
    "controls": {
      "type": "object",
      "description": "THE RED CONTROLS, PER CHANNEL, as measured on the run that wrote this record. `--execute` REFUSES to overwrite a good record with one whose controls failed: a stale-but-real clearance beats a fresh record full of \"I could not check\".",
      "required": ["green", "failed"],
      "additionalProperties": false,
      "properties": {
        "green": { "type": "integer" },
        "failed": {
          "type": "array",
          "description": "Channel ids whose control did not come back. Non-empty means every verdict in this record is worth less than it looks, and the guard says so.",
          "items": { "type": "string" }
        }
      }
    },
    "channels": {
      "type": "object",
      "description": "One entry per channel in tooling/channel-register.json, keyed by its `id`. THE SET IS THE REGISTER'S, NOT A LIST KEPT HERE: a channel with no probe registered appears with verdict UNDETERMINED and says so, and is never silently absent.",
      "additionalProperties": {
        "type": "object",
        "required": ["verdict", "uniqueness", "why"],
        "additionalProperties": false,
        "anyOf": [
          { "properties": { "verdict": { "enum": ["PROVEN-FREE", "PROVEN-TAKEN", "UNDETERMINED", "NOT-APPLICABLE"] } } },
          { "required": ["storeRecordId", "heldBy", "heldOn"], "properties": { "verdict": { "const": "HELD" }, "heldBy": { "const": "owner" } } },
          { "required": ["storeRecordId", "heldBy", "heldOn", "delegation", "proof"], "properties": { "verdict": { "const": "HELD" }, "heldBy": { "const": "lead" } } }
        ],
        "description": "The `anyOf` is `if verdict is HELD then storeRecordId, heldBy and heldOn are required — and a hold the LEAD recorded also carries the owner delegation it acted under and the API proof it rests on`, spelled in the keywords tooling/app-yaml/schema-validate.mjs implements (it has no `if`/`then`, and refuses a keyword it does not implement).",
        "properties": {
          "verdict": {
            "type": "string",
            "enum": ["PROVEN-FREE", "PROVEN-TAKEN", "UNDETERMINED", "NOT-APPLICABLE", "HELD"],
            "description": "THREE ANSWERS, NEVER TWO, plus the non-answer for a channel with no namespace, plus HELD — the one verdict no probe can write. UNDETERMINED never counts as clear. HELD is the OWNER'S record that the name is reserved in that store's own console, which no unauthenticated probe can see; it carries the store's record id, is written only by `node tooling/store/name-clearance.mjs --hold <channel> --record <store record id> --app <slug>`, and `--execute` carries it forward rather than re-probing over it."
          },
          "storeRecordId": {
            "type": "string",
            "minLength": 1,
            "description": "HELD only. The store's own id for the reservation, as the owner read it off the console: Play's package entry, App Store Connect's Apple ID, Partner Center's reserved-name product id, the registered snap name. A HELD without it is a claim nobody can look up."
          },
          "heldBy": {
            "type": "string",
            "enum": ["owner", "lead"],
            "description": "HELD only. WHO RECORDED THE HOLD. `owner`: the owner read the reservation off a console they sign into. `lead` (⏱ 2026-10-01, #1099 review finding 3): the lead recorded it under a cited owner delegation, from a store API that proves the record is ours — so it must carry `delegation` and `proof`. Provenance is the whole value of this record; it never says `owner` for an act the owner did not perform."
          },
          "delegation": {
            "type": "string",
            "minLength": 1,
            "description": "HELD by `lead` only. The owner delegation the lead acted under, cited: who said it, when, and where it is recorded."
          },
          "proof": {
            "type": "object",
            "required": ["call", "result", "observedOn"],
            "additionalProperties": false,
            "description": "HELD by `lead` only. The authenticated store-API read that proves the store record is this factory's: the call made, what it answered, and the date.",
            "properties": {
              "call": { "type": "string", "minLength": 1 },
              "result": { "type": "string", "minLength": 1 },
              "observedOn": { "type": "string", "format": "date" }
            }
          },
          "heldOn": {
            "type": "string",
            "format": "date",
            "description": "HELD only. The local date the hold was recorded."
          },
          "uniqueness": {
            "type": "string",
            "enum": ["global", "tolerated", "none", "UNKNOWN"],
            "description": "`global` — the store refuses a duplicate, so a hit is a wall. `tolerated` — a hit is a discoverability cost. `none` — no third party holds a name here. `UNKNOWN` — no probe is registered for this channel."
          },
          "why": { "type": "string", "minLength": 1 },
          "evidence": { "type": "array", "items": { "type": "string" } },
          "control": {
            "anyOf": [
              { "type": "null" },
              {
                "type": "object",
                "required": ["what", "green"],
                "additionalProperties": false,
                "properties": {
                  "what": { "type": "string" },
                  "green": { "type": "boolean" },
                  "detail": { "type": "string" }
                }
              }
            ]
          }
        }
      }
    },
    "identifiers": {
      "type": "array",
      "description": "THE PERMANENT IDENTIFIERS, which unlike names can never be changed or recycled once claimed. Every value here is read by tooling/ci/read-identity.mjs from the file tooling/channel-register.json declares — never synthesised from the name, because a name change that updates four of five files is exactly the defect [10]D-3 exists to catch.",
      "items": {
        "type": "object",
        "required": ["channel", "kind", "verdict", "why"],
        "additionalProperties": false,
        "properties": {
          "channel": { "type": "string" },
          "kind": { "type": "string" },
          "declaredIn": { "anyOf": [{ "type": "null" }, { "type": "string" }] },
          "value": { "anyOf": [{ "type": "null" }, { "type": "string" }] },
          "verdict": { "type": "string", "enum": ["PROVEN-FREE", "PROVEN-TAKEN", "UNDETERMINED", "NOT-APPLICABLE"] },
          "why": { "type": "string", "minLength": 1 }
        }
      }
    },
    "trademark": {
      "type": "object",
      "description": "ADVISORY SIGNAL ONLY. SOFTWARE CANNOT CLEAR A TRADEMARK AND THIS RECORD DOES NOT PRETEND OTHERWISE. Registry databases (USPTO TSDR, the UK IPO, the Indian registry) are not reachable from an unauthenticated read, and are not faked: an absence of evidence is recorded as an absence of evidence. `ruling: null` reads as QUALIFIED — never as a pass.",
      "required": ["disclaimer", "signals", "ruling", "ruledBy", "ruledOn"],
      "additionalProperties": false,
      "properties": {
        "disclaimer": {
          "type": "string",
          "description": "Printed verbatim by both the probe and the guard. It must say, in the output itself, that this is not legal advice."
        },
        "signals": { "type": "array", "items": { "type": "string" } },
        "ruling": {
          "anyOf": [{ "type": "null" }, { "type": "string", "enum": ["PROCEED", "DO-NOT-PROCEED"] }],
          "description": "ONLY THE OWNER WRITES THIS. null is not neutral: it is a finding that a dated ruling is owed."
        },
        "ruledBy": { "anyOf": [{ "type": "null" }, { "type": "string" }] },
        "ruledOn": { "anyOf": [{ "type": "null" }, { "type": "string", "format": "date" }] },
        "basis": {
          "anyOf": [{ "type": "null" }, { "type": "string", "minLength": 1, "pattern": "\\S" }],
          "description": "WHAT THE RULING RESTS ON — the decision record a reader opens to check it (`ADR 074`). Optional in the shape so a record written before the field existed still parses; tooling/ci/assert-name-clearance.mjs limb 7 refuses a non-null `ruling` without it. A whitespace-only string is refused here too (`pattern`), because a blank basis names nothing a reader can open."
        },
        "ownerItem": {
          "anyOf": [{ "type": "null" }, { "type": "string" }],
          "description": "The owner id that carries the owed ruling: a row of Private/platform-state/open.json such as `O-NAME-CLEARANCE-WAITS-ON-A-MISSING-ROW`, or of the owner queue such as `A-12` (the id shape and the lookup are tooling/scripts/owner-ids.mjs). A null ruling with no owner item is a finding nobody owns, so the guard refuses it outright. tooling/scripts/assert-public-citations.mjs looks the id up in BOTH registers and refuses one that neither carries, one that both carry, and a live row whose text (`blocks` or `closes`, in open.json) never names this file's repo-relative path. Once `ruling` is recorded the id is provenance and holds nothing."
        },
        "gatedUntil": {
          "anyOf": [{ "type": "null" }, { "type": "string", "format": "date" }],
          "description": "THE BOUND ON THE OWNER GATE, and it is a bound rather than a waiver. While this date is in the future a null ruling PRINTS AS FAILING and does not block the build; on and after it, it blocks. It is written ONCE, by hand, and `--execute` PRESERVES it — a re-probe must never be able to extend its own gate, which is how a waiver outlives its reason."
        }
      }
    }
  }
}
