{
  "_why": [
    "GENERATED — whyLines() in tooling/store/name-clearance-why.mjs computes these lines from this record's own fields, and limb 11 of tooling/ci/assert-name-clearance.mjs refuses any other text. Change a field, then regenerate offline: node tooling/store/name-clearance.mjs --why --app subscriptiontracker",
    "\"Nikatru Subscription Tracker\", probed 2026-09-28; overall UNDETERMINED. Re-probe (networked, ~20 external calls): node tooling/store/name-clearance.mjs 'Nikatru Subscription Tracker' --app subscriptiontracker --execute",
    "Clear (PROVEN-FREE) — an authority answered \"no such name\" with its red control green: web, amo.",
    "Held (HELD) — the name is reserved in that store's console under a recorded id, attested by the owner, or by the lead under a cited owner delegation with the store-API proof: android-play (store record com.nikatru.subscriptiontracker, 2026-10-01; recorded by the lead under the owner's 2026-10-01 delegation ('Always You Do': every step but the final rollout), relayed and ruled by lead db0cc7 in Private/research/session-2026-09-23/lead-1m/reviews/prep-play-first-release.review-2026-10-01.md).",
    "Blocked for a submission (PROVEN-TAKEN) — a live record holds the name: none.",
    "Blocked for a submission (UNDETERMINED) — could not check, which is never a pass: ios-appstore (global), macos-appstore (global), windows-store, linux-snap (global), chrome-webstore, edge-addons.",
    "Not applicable (NOT-APPLICABLE) — no third party holds a name there, and no submission passes on it: windows-direct, linux-appimage, apps-gov-in.",
    "Trademark: PROCEED, ruled by owner on 2026-09-09, basis ADR 074 (owner, 2026-09-09: store name chosen; section 6 defers the NIKATRU mark), read and applied by the parent on 2026-09-24 under the owner's 2026-09-23 delegation. No software can clear a trademark; the ruling is the owner's.",
    "A submit lane runs node tooling/ci/assert-name-clearance.mjs --for-submission=<channel>, which passes only PROVEN-FREE, or HELD with its store record id, on that channel. The owner records a hold with: node tooling/store/name-clearance.mjs --hold <channel> --record <store record id> --app subscriptiontracker",
    "Whether a channel can reach a user today is register state and is not written here: tooling/ci/assert-name-clearance.mjs reads it off tooling/channel-register.json on every run."
  ],
  "app": "subscriptiontracker",
  "slug": "nikatrusubscriptiontracker",
  "name": {
    "value": "Nikatru Subscription Tracker",
    "asOf": "2026-09-28",
    "verify": "node tooling/store/name-clearance.mjs 'Nikatru Subscription Tracker' --app subscriptiontracker --execute",
    "verifyKind": "remote"
  },
  "asOf": "2026-09-28",
  "channels": {
    "web": {
      "verdict": "PROVEN-FREE",
      "uniqueness": "none",
      "why": "No OTHER app in catalog/apps.json declares this name, and the web host is a subdomain of a wildcard this factory controls ([ADR 006]), so no external party can hold it. This is the one channel whose namespace is ours, which is why FREE is provable here and nowhere else.",
      "evidence": [
        "catalog/apps.json row \"subscriptiontracker\" carries this name — SELF, NOT A COLLISION, excluded from the comparison."
      ],
      "control": null
    },
    "android-play": {
      "verdict": "HELD",
      "uniqueness": "tolerated",
      "why": "HELD, recorded by the lead on 2026-10-01 under the owner's 2026-10-01 delegation ('Always You Do': every step but the final rollout), relayed and ruled by lead db0cc7 in Private/research/session-2026-09-23/lead-1m/reviews/prep-play-first-release.review-2026-10-01.md: the store's own API shows record com.nikatru.subscriptiontracker is ours (androidpublisher v3, authenticated as this factory's Play service account: edits.insert, then edits.tracks.list and edits.bundles.list on applications/com.nikatru.subscriptiontracker (edit discarded, nothing committed) → 200 on all three; track internal carries release '1 (2026-09-22)', versionCode 1, status completed; bundles lists versionCode 1 (sha256 d6d69b9ab0b44932f37115de17fe9214458ce38fb3f604a1e65f12e66d52b22a), observed 2026-10-01). No unauthenticated probe can see a console reservation, so --execute carries this verdict forward rather than re-probing over it. Before the hold the probe read UNDETERMINED: Play TOLERATES duplicate titles, so a title hit would be advisory rather than blocking — but the store search surface is JS-rendered with no unauthenticated API, so NO TITLE VERDICT can be proven here. The permanent applicationId is free of any PUBLISHED listing (control green, HTTP 404); a draft in somebody's console would not show. MANUAL/AUTHENTICATED STEP: a logged-in Play Console title check.",
      "evidence": [
        "apps/subscriptiontracker/android/app/build.gradle.kts declares com.nikatru.subscriptiontracker",
        "applicationId com.nikatru.subscriptiontracker — HTTP 404, no published listing holds it (control green)."
      ],
      "control": {
        "what": "play.google.com details?id=com.spotify.music (known present)",
        "green": true,
        "detail": "HTTP 200"
      },
      "storeRecordId": "com.nikatru.subscriptiontracker",
      "heldBy": "lead",
      "heldOn": "2026-10-01",
      "delegation": "the owner's 2026-10-01 delegation ('Always You Do': every step but the final rollout), relayed and ruled by lead db0cc7 in Private/research/session-2026-09-23/lead-1m/reviews/prep-play-first-release.review-2026-10-01.md",
      "proof": {
        "call": "androidpublisher v3, authenticated as this factory's Play service account: edits.insert, then edits.tracks.list and edits.bundles.list on applications/com.nikatru.subscriptiontracker (edit discarded, nothing committed)",
        "result": "200 on all three; track internal carries release '1 (2026-09-22)', versionCode 1, status completed; bundles lists versionCode 1 (sha256 d6d69b9ab0b44932f37115de17fe9214458ce38fb3f604a1e65f12e66d52b22a)",
        "observedOn": "2026-10-01"
      }
    },
    "ios-appstore": {
      "verdict": "UNDETERMINED",
      "uniqueness": "global",
      "why": "No iOS listing carries this name (control green, 194 result(s) scanned). THIS IS NOT PROOF OF AVAILABILITY: the search index omits unreleased and name-reserved records, and Apple exposes no availability endpoint short of creating a record — which is forbidden here. MANUAL STEP: the App Store Connect new-app dialog, read and cancelled without saving.",
      "evidence": [],
      "control": {
        "what": "itunes.apple.com/lookup?bundleId=com.google.Gmail (known present: \"Gmail - Email by Google\")",
        "green": true,
        "detail": "HTTP 200, resultCount 1"
      }
    },
    "macos-appstore": {
      "verdict": "UNDETERMINED",
      "uniqueness": "global",
      "why": "No macOS listing carries this name (control green, 33 result(s) scanned). THIS IS NOT PROOF OF AVAILABILITY: the search index omits unreleased and name-reserved records, and Apple exposes no availability endpoint short of creating a record — which is forbidden here. MANUAL STEP: the App Store Connect new-app dialog, read and cancelled without saving.",
      "evidence": [],
      "control": {
        "what": "itunes.apple.com/lookup?bundleId=com.google.Gmail (known present: \"Gmail - Email by Google\")",
        "green": true,
        "detail": "HTTP 200, resultCount 1"
      }
    },
    "windows-store": {
      "verdict": "UNDETERMINED",
      "uniqueness": "tolerated",
      "why": "Microsoft TOLERATES duplicate display names, and the ONLY authority on a Store name is the Partner Center \"reserve a name\" dialog — pressing which IS the reservation, and starts a three-month submit-or-lose clock. That is a mutation and is refused here. MANUAL STEP, OWNER ONLY: open the reserve-name dialog, read the inline availability answer, and CANCEL without reserving.",
      "evidence": [
        "winget/Store catalogue substring search returned 0 rows (control green). ADVISORY only."
      ],
      "control": {
        "what": "storeedgefd manifestSearch KeyWord \"firefox\" (known non-empty)",
        "green": true,
        "detail": "HTTP 200, 1 row(s)"
      }
    },
    "windows-direct": {
      "verdict": "NOT-APPLICABLE",
      "uniqueness": "none",
      "why": "kind:\"direct\" — a download from a host this factory owns. No third party holds a name here; the only namespace is our own filename.",
      "evidence": [],
      "control": null
    },
    "linux-snap": {
      "verdict": "UNDETERMINED",
      "uniqueness": "global",
      "why": "No PUBLISHED snap holds \"nikatru-subscription-tracker\" (control green, HTTP 404). ⚠️ A name REGISTERED BUT UNPUBLISHED returns EXACTLY this same 404 — the snap namespace is claimed by registration, not by publication — so this is \"no published snap\", NOT \"registerable\". MANUAL STEP: `snapcraft register --dry-run nikatru-subscription-tracker` under the owner's account.",
      "evidence": [
        "https://api.snapcraft.io/v2/snaps/info/nikatru-subscription-tracker — HTTP 404"
      ],
      "control": {
        "what": "api.snapcraft.io/v2/snaps/info/firefox (known present)",
        "green": true,
        "detail": "HTTP 200"
      }
    },
    "linux-appimage": {
      "verdict": "NOT-APPLICABLE",
      "uniqueness": "none",
      "why": "kind:\"direct\" — an AppImage from a host this factory owns. No third-party name authority exists.",
      "evidence": [],
      "control": null
    },
    "apps-gov-in": {
      "verdict": "NOT-APPLICABLE",
      "uniqueness": "tolerated",
      "why": "The register declares `served: false`, `submittable: false` and no submission API — a manual web upload forever. There is no namespace to contest until a submission exists.",
      "evidence": [],
      "control": null
    },
    "chrome-webstore": {
      "verdict": "UNDETERMINED",
      "uniqueness": "tolerated",